id|Name|CR|Type|HD|HP|INIT|SPD|AC|BAB|GRP|ATK|FATK|SpRe|SA|SQ|AL|SV|Abb|SnF|Ref
480|Dire wolf form werewolf lord|14|Large humanoid|10d10+20 plus 6d8+30|132|+4|40 ft. (8 squares)|19 (-1 size, +4 dex, +6 natural), touch 13, flat-footed 15|+14|+29|+25 melee (2d6+16/19-20, bite)|+25 melee (2d6+16/19-20, bite)|10 ft./5 ft.|Curse of lycanthropy, trip|Alternate form, wolf empathy, damage reduction 10/silver, low-light vision, scent|CE|Fort +17, Ref +12, Will +11|Str 32, Dex 18, Con 20, Int 10, Wis 12, Cha 12|Handle Animal +4, Hide +6, Listen +9, Move Silently +12, Spot +13, Survival +5*; (same as human form)|MM_p176
481|Hybrid form werewolf lord|14|Large humanoid|10d10+20 plus 6d8+30|132|+4|30 ft. (6 squares)|19 (-1 size, +4 dex, +6 natural), touch 13, flat-footed 15|+14|+27|+24 melee (1d6+11, claw) or +2 bastard sword +27 melee ()|+24 melee (1d6+11, 2 claws) and +20 melee (2d6+5/19-20, bite) or +2 bastard sword +27/+22/+17 melee (2d8+15/17-20,) and +20 melee (2d6+5/19-20, bite)|10 ft./10 ft.|Curse of lycanthropy|Alternate form, wolf empathy, damage reduction 10/silver, low-light vision, scent|CE|Fort +17, Ref +12, Will +11|Str 32, Dex 18, Con 20, Int 10, Wis 12, Cha 12|Handle Animal +4, Hide +6, Listen +9, Move Silently +12, Spot +13, Survival +5*; (same as human form)|MM_p176
482|Hill giant dire wereboar giant form|11|Large giant (shapechanger)|12d8+51 plus 7d8+49|185|-1|Spd 30 ft. in hide armor (6 squares); base speed 40 ft.""|22 (-1 size, -1 dex, +11 natural, +3 hide armor), touch 8, flat-footed 22|+14|+25|+21 melee (2d8+10, greatclub) or +20 melee (1d4+7, slam) or +12 ranged (2d6+7, rock)|+21 /+16 melee (2d8+10, greatclub) or +20 melee (1d4+7, 2 slams) or +12 ranged (2d6+7, rock)|10 ft./10 ft.|Rock throwing|Alternate form, boar empathy, ferocity, low-light vision, rock catching, scent|N|Fort +17, Ref +8, Will +12|Str 25, Dex 8, Con 19, Int 6, Wis 12, Cha 7|Climb +10, Jump +10, Listen +10, Spot +12; Alertness, Cleave, Endurance, Improved Bull Rush, Improved Sunder, Iron Will, Power Attack, Weapon Focus (greatclub)|MM_p177
483|Hill giant dire wereboar dire boar form|11|Large giant (shapechanger)|12d8+51 plus 7d8+49|185|-1|40 ft. (8 squares)|16 (-1 size, -1 dex, +8 natural), touch 8, flat-footed 16|+14|+33|+28 melee (1d8+22, gore)|+28 melee (1d8+22, gore)|10 ft./5 ft.|Curse of lycanthropy|Alternate form, boar empathy, damage reduction 10/silver, ferocity, low-light vision, scent|N|Fort +20, Ref +8, Will +12|Str 41, Dex 8, Con 25, Int 6, Wis 12, Cha 7|Climb +18, Jump +22, Listen +10, Spot +12; (same as giant form)|MM_p177
484|Hill giant dire wereboar hybrid boar form|11|Large giant (shapechanger)|12d8+51 plus 7d8+49|185|-1|40 ft. (8 squares)|19 (-1 size, -1 dex, +11 natural), touch 8, flat-footed 19|+14|+33|+29 melee (2d8+22, greatclub) or +28 melee (1d6+15, claw)|+29 melee (2d8+22, greatclub) and +23 melee (1d8+7, gore) or +28 melee (1d6+15, 2 claws) and +23 melee (1d8+7, gore)|10 ft./10 ft.|Curse of lycanthropy|Alternate form, boar empathy, damage reduction 10/silver, ferocity, low-light vision, scent|N|Fort +20, Ref +8, Will +12|Str 41, Dex 8, Con 25, Int 6, Wis 12, Cha 7|Climb +18, Jump +22, Listen +10, Spot +12; (same as giant form)|MM_p177
485|Magmin|3|Small elemental (fire, extraplanar)|2d8+2|11|+0|30 ft. (6 squares)|17 (+1 size, +6 natural), touch 11, flat-footed 17|+1|-1|+4 melee (1d8 fire plus combustion, burning touch) or +4 melee (1d3+3 plus combustion, slam)|+4 melee (1d8 fire plus combustion, burning touch) or +4 melee (1d3+3 plus combustion, slam)|5 ft./5 ft.|Combustion, fiery aura|Damage reduction 5/magic, darkvision 60 ft., elemental traits, immunity to fire, melt weapons, vulnerability to cold|CN|Fort +3, Ref +3, Will +0|Str 15, Dex 11, Con 13, Int 8, Wis 10, Cha 10|Climb +4, Spot +3; Great Fortitude|MM_p179
486|Manticore|5|Large magical beast|6d10+24|57|+2|30 ft. (6 squares), fly 50 ft. (clumsy)|17 (-1 size, +2 dex, +6 natural), touch 11, flat-footed 15|+6|+15|+10 melee (2d4+5, claw) or +8 ranged (1d8+2/19-20, 6 spikes)|+10 melee (2d4+5, 2 claws) and +8 melee (1d8+2, bite) or +8 ranged (1d8+2/19-20, 6 spikes)|10 ft./5 ft.|Spikes|Darkvision 60 ft., low-light vision, scent|LE|Fort +9, Ref +7, Will +3|Str 20, Dex 15, Con 19, Int 7, Wis 12, Cha 9|Listen +5, Spot +9, Survival +1; Flyby Attack, Multiattack, Track, Weapon Focus (spikes)|MM_p179
487|Medusa|7|Medium monstrous humanoid|6d8+6|33|+2|30 ft. (6 squares)|15 (+2 dex, +3 natural), touch 12, flat-footed 13|+6|+6|+8 ranged (1d6/x3, shortbow) or +8 melee (1d4/19-20, dagger) or +8 melee (1d4 plus poison, snakes)|+8 /+3 ranged (1d6/x3, shortbow) or +8 /+3 melee (1d4/19-20, dagger) and +3 melee (1d4 plus poison, snakes)|5 ft./5 ft.|Petrifying gaze, poison|Darkvision 60 ft.|LE|Fort +3, Ref +7, Will +6|Str 10, Dex 15, Con 12, Int 12, Wis 13, Cha 15|Bluff +9, Diplomacy +4, Disguise +9 (+11 acting), Intimidate +4, Move Silently +8, Spot +8; Point Blank Shot, Precise Shot, Weapon Finesse|MM_p180
488|Air mephit|3|Small outsider (air, extraplanar)|3d8|13|+7|30 ft. (6 squares), fly 60 ft. (perfect)|17 (+1 size, +3 dex, +3 natural), touch 14, flat-footed 14|+3|-1|+4 melee (1d3, claw)|+4 melee (1d3, 2 claws)|5 ft./5 ft.|Breath weapon, spell-like abilities, summon mephit|Damage reduction 5/magic, darkvision 60 ft., fast healing 2|N|Fort +3, Ref +6, Will +3|Str 10, Dex 17, Con 10, Int 6, Wis 11, Cha 15|Bluff +8, Escape Artist +9, Hide +13, Diplomacy +4, Disguise +2 (+4 acting), Intimidate +4, Listen +6, Move Silently +9, Spot +6, Use Rope +3 (+5 with bindings); Dodge, Improved Initiative|MM_p181
489|Dust mephit|3|Small outsider (air, extraplanar)|3d8|13|+7|30 ft. (6 squares), fly 50 ft. (perfect)|17 (+1 size, +3 dex, +3 natural), touch 14, flat-footed 14|+3|-1|+4 melee (1d3, claw)|+4 melee (1d3, 2 claws)|5 ft./5 ft.|Breath weapon, spell-like abilities, summon mephit|Damage reduction 5/magic, darkvision 60 ft., fast healing 2|N|Fort +3, Ref +6, Will +3|Str 10, Dex 17, Con 10, Int 6, Wis 11, Cha 15|Bluff +8, Escape Artist +9, Hide +13, Diplomacy +4, Disguise +2 (+4 acting), Intimidate +4, Listen +6, Move Silently +9, Spot +6, Use Rope +3 (+5 with bindings); Dodge, Improved Initiative|MM_p181
490|Earth mephit|3|Small outsider (earth, extraplanar)|3d8+6|19|-1|30 ft. (6 squares), fly 40 ft. (average)|16 (+1 size, -1 dex, +6 natural), touch 10, flat-footed 16|+3|+2|+7 melee (1d3+3, claw)|+7 melee (1d3+3, 2 claws)|5 ft./5 ft.|Breath weapon, spell-like abilities, summon mephit|Change size, damage reduction 5/magic, darkvision 60 ft., fast healing 2|N|Fort +4, Ref +2, Will +3|Str 17, Dex 8, Con 13, Int 6, Wis 11, Cha 15|Bluff +8, Escape Artist +5, Hide +9, Diplomacy +4, Disguise +2 (+4 acting), Intimidate +4, Listen +6, Move Silently +5, Spot +6, Use Rope -1 (+1 with bindings); Power Attack, Toughness|MM_p182
491|Fire mephit|3|Small outsider (extraplanar, fire)|3d8|13|+5|30 ft. (6 squares), fly 50 ft. (average)|16 (+1 size, +1 dex, +4 natural), touch 12, flat-footed 15|+3|-1|+4 melee (1d3 and 1d4 fire, claw)|+4 melee (1d3 and 1d4 fire, 2 claws)|5 ft./5 ft.|Breath weapon, spell-like abilities, summon mephit|Damage reduction 5/magic, darkvision 60 ft., immunity to fire, fast healing 2, vulnerability to cold|N|Fort +3, Ref +4, Will +3|Str 10, Dex 13, Con 10, Int 6, Wis 11, Cha 15|Bluff +8, Escape Artist +7, Hide +11, Listen +6, Diplomacy +4, Disguise +2 (+4 acting), Move Silently +7, Spot +6, Use Rope +1 (+3 with bindings); Dodge, Improved Initiative|MM_p182
492|Ice mephit|3|Small outsider (air, cold, extraplanar)|3d8|13|+7|30 ft. (6 squares), fly 50 ft. (perfect)|18 (+1 size, +3 dex, +4 natural), touch 14, flat-footed 15|+3|-1|+4 melee (1d3 plus 1d4 cold, claw)|+4 melee (1d3 plus 1d4 cold, 2 claws)|5 ft./5 ft.|Breath weapon, spell-like abilities, summon mephit|Damage reduction 5/magic, darkvision 60 ft., fast healing 2, immunity to cold, vulnerability to fire|N|Fort +3, Ref +6, Will +3|Str 10, Dex 17, Con 10, Int 6, Wis 11, Cha 15|Bluff +8, Escape Artist +9, Hide +13, Listen +6, Diplomacy +4, Disguise +2 (+4 acting), Move Silently +9, Spot +6, Use Rope +3 (+5 with bindings); Dodge, Improved Initiative|MM_p182
493|Magma mephit|3|Small outsider (fire, extraplanar)|3d8|13|+5|30 ft. (6 squares), fly 50 ft. (average)|16 (+1 size, +1 dex, +4 natural), touch 12, flat-footed 15|+3|-1|+4 melee (1d3 plus 1d4 fire, claw)|+4 melee (1d3 plus 1d4 fire, 2 claws)|5 ft./5 ft.|Breath weapon, spell-like abilities, summon mephit|Damage reduction 5/magic, darkvision 60 ft., fast healing 2, immunity to fire, vulnerability to cold|N|Fort +3, Ref +4, Will +3|Str 10, Dex 13, Con 10, Int 6, Wis 11, Cha 15|Bluff +8, Escape Artist +7, Hide +11, Listen +6, Diplomacy +4, Disguise +2 (+4 acting), Move Silently +7, Spot +6, Use Rope +1 (+3 with bindings); Dodge, Improved Initiative|MM_p183
494|Ooze mephit|3|Small outsider (extraplanar, water)|3d8+6|19|+0|30 ft. (6 squares), fly 40 ft. (average), swim 30 ft.|16 (+1 size, +5 natural), touch 11, flat-footed 16|+3|+1|+6 melee (1d3+2, claw)|+6 melee (1d3+2, 2 claws)|5 ft./5 ft.|Breath weapon, spell-like abilities, summon mephit|Damage reduction 5/magic, darkvision 60 ft., fast healing 2|N|Fort +4, Ref +3, Will +3|Str 14, Dex 10, Con 13, Int 6, Wis 11, Cha 15|Bluff +8, Escape Artist +6, Hide +10, Listen +6, Diplomacy +4, Disguise +2 (+4 acting), Move Silently +6, Spot +6, Swim +10, Use Rope +0 (+2 with bindings); Power Attack, Toughness|MM_p183
495|Salt mephit|3|Small outsider (earth, extraplanar)|3d8+6|19|-1|30 ft. (6 squares), fly 40 ft. (average)|16 (+1 size, -1 dex, +6 natural), touch 10, flat-footed 16|+3|+2|+7 melee (1d3+3, claw)|+7 melee (1d3+3, 2 claws)|5 ft./5 ft.|Breath weapon, spell-like abilities, summon mephit|Damage reduction 5/magic, darkvision 60 ft., fast healing 2|N|Fort +4, Ref +2, Will +3|Str 17, Dex 8, Con 13, Int 6, Wis 11, Cha 15|Bluff +8, Escape Artist +5, Hide +9, Listen +6, Diplomacy +4, Disguise +2 (+4 acting), Move Silently +5, Spot +6, Use Rope -1 (+1 with bindings); Power Attack, Toughness|MM_p184
496|Steam mephit|3|Small outsider (extraplanar, fire)|3d8|13|+5|30 ft. (6 squares), fly 50 ft. (average)|16 (+1 size, +1 dex, +4 natural), touch 12, flat-footed 15|+3|-1|+4 melee (1d3 plus 1d4 fire, claw)|+4 melee (1d3 plus 1d4 fire, 2 claws)|5 ft./5 ft.|Breath weapon, spell-like abilities, summon mephit|Damage reduction 5/magic, darkvision 60 ft., fast healing 2, immunity to fire, vulnerability to cold|N|Fort +3, Ref +4, Will +3|Str 10, Dex 13, Con 10, Int 6, Wis 11, Cha 15|Bluff +8, Escape Artist +7, Hide +11, Listen +6, Diplomacy +4, Disguise +2 (+4 acting), Move Silently +7, Spot +6, Use Rope +1 (+3 with bindings); Dodge, Improved Initiative|MM_p184
497|Water mephit|3|Small outsider (extraplanar, water)|3d8+6|19|+0|30 ft. (6 squares), fly 40 ft. (average), swim 30 ft.|16 (+1 size, +5 natural), touch 11, flat-footed 16|+3|+1|+6 melee (1d3+2, claw)|+6 melee (1d3+2, 2 claws)|5 ft./5 ft.|Breath weapon, spell-like abilities, summon mephit|Damage reduction 5/magic, darkvision 60 ft., fast healing 2|N|Fort +4, Ref +3, Will +3|Str 14, Dex 10, Con 13, Int 6, Wis 11, Cha 15|Bluff +8, Escape Artist +6, Hide +10, Listen +6, Diplomacy +4, Disguise +2 (+4 acting), Move Silently +6, Spot +6, Swim +10, Use Rope +0 (+2 with bindings); Power Attack, Toughness|MM_p185
498|1st-level warrior merfolk|1/2|Medium humanoid (aquatic)|1d8+2|6|+1|5 ft. (1 square), swim 50 ft.|13 (+1 dex, +2 leather), touch 11, flat-footed 12|+1|+2|+2 melee (1d8+1, trident) or +2 ranged (1d10/19-20, heavy crossbow)|+2 melee (1d8+1, trident) or +2 ranged (1d10/19-20, heavy crossbow)|5 ft./5 ft.|-|Amphibious, low-light vision|N|Fort +4, Ref +1, Will -1|Str 13, Dex 13, Con 14, Int 10, Wis 9, Cha 10|Listen +3, Spot +3, Swim +9; Alertness|MM_p185
499|Mimic|4|Large aberration (shapechanger)|7d8+21|52|+1|10 ft. (2 squares)|15 (-1 size, +1 dex, +5 natural), touch 10, flat-footed 15|+5|+13|+9 melee (1d8+4, slam)|+9 melee (1d8+4, 2 slams)|10 ft./10 ft.|Adhesive, crush|Darkvision 60 ft., immunity to acid, mimic shape|N|Fort +5, Ref +5, Will +6|Str 19, Dex 12, Con 17, Int 10, Wis 13, Cha 10|Climb +9, Disguise +13, Listen +8, Spot +8; Alertness, Lightning Reflexes, Weapon Focus (slam)|MM_p186
500|Minotaur|4|Large monstrous humanoid|6d8+12|39|+0|30 ft. (6 squares)|14 (-1 size, +5 natural), touch 9, flat-footed 14|+6|+14|+9 melee (3d6+6/x3, greataxe) or +9 melee (1d8+4, gore)|+9 /+4 melee (3d6+6/x3, greataxe) and +4 melee (1d8+2, gore)|10 ft./10 ft.|Powerful charge 4d6+6|Darkvision 60 ft., natural cunning, scent|CE|Fort +6, Ref +5, Will +5|Str 19, Dex 10, Con 15, Int 7, Wis 10, Cha 8|Intimidate +2, Listen +7, Search +2, Spot +7; Great Fortitude, Power Attack, Track|MM_188
501|Mohrg|8|Medium undead|14d12|91|+9|30 ft. (6 squares)|23 (+4 dex, +9 natural), touch 14, flat-footed 14|+7|+12|+12 melee (1d6+7, slam) or +12 melee (paralysis, tongue)|+12 melee (1d6+7, slam) and +12 melee (paralysis, tongue)|5 ft./5 ft.|Improved grab, paralyzing touch, create spawn|Darkvision 60 ft., undead traits|CE|Fort +4, Ref +10, Will +9|Str 21, Dex 19, Con -, Int 11, Wis 10, Cha 10|Climb +13, Hide +21, Listen +11, Move Silently +21, Spot +15, Swim +9; Alertness, Dodge, Improved Initiative, Lightning Reflexes, Mobility|MM_p189
502|Mummy|5|Medium undead|8d12+3|55|+0|20 ft. (4 squares)|20 (+10 natural), touch 10, flat-footed 20|+4|+11|+11 melee (1d6+10 plus mummy rot, slam)|+11 melee (1d6+10 plus mummy rot, slam)|5 ft./5 ft.|Despair, mummy rot|Damage reduction 5/-, darkvision 60 ft., undead traits, vulnerability to fire|LE|Fort +4, Ref +2, Will +8|Str 24, Dex 10, Con -, Int 6, Wis 14, Cha 15|Hide +7, Listen +8, Move Silently +7, Spot +8; Alertness, Great Fortitude, Toughness|MM_p190
503|10th-level cleric mummy lord|15|Medium undead|8d12 plus 10d8|97|+5|Spd 15 ft. in half-plate armor (3 squares); base speed 20 ft.""|30 (+1 dex, +10 natural, +9 +2 half-plate armor), touch 11, flat-footed 29|+11|+19|+20 melee (1d6+12/19-20 plus mummy rot, slam)|+20 melee (1d6+12/19-20 plus mummy rot, slam)|5 ft./5 ft.|Despair, mummy rot, rebuke undead, spells|Damage reduction 5/-, darkvision 60 ft., fire resistance 10, undead traits, vulnerability to fire|LE|Fort +13, Ref +8, Will +20|Str 26, Dex 12, Con -, Int 8, Wis 20, Cha 17|Concentration +8, Knowledge (religion) +4, Listen +18, Move Silently +5, Spot +18; Alertness, Combat Casting, Great Fortitude, Improved Critical (slam), Improved Initiative, Weapon Focus (slam)|MM_p190
504|Dark naga|8|Large aberration|9d8+18|58|+2|40 ft. (8 squares)|14 (-1 size, +2 dex, +3 natural), touch 11, flat-footed 12|+6|+12|+7 melee (2d4+2 plus poison, sting)|+7 melee (2d4+2 plus poison, sting) and +2 melee (1d4+1, bite)|10 ft./5 ft.|Poison, spells|Darkvision 60 ft., detect thoughts, guarded thoughts, immunity to poison, resistance to charm|LE|Fort +5, Ref +7, Will +8|Str 14, Dex 15, Con 14, Int 16, Wis 15, Cha 17|Bluff +9, Concentration +13, Diplomacy +7, Disguise +5 (+7 acting), Intimidate +5, Listen +11, Sense Motive +8, Spellcraft +12, Spot +11; Alertness, Combat Casting, Dodge, Eschew Materials, Lightning Reflexes|MM_p191
505|Guardian naga|10|Large aberration|11d8+44|93|+2|40 ft. (8 squares)|18 (-1 size, +2 dex, +7 natural), touch 11, flat-footed 16|+8|+17|+12 melee (2d6+7 plus poison, bite) or +9 ranged touch (poison, spit)|+12 melee (2d6+7 plus poison, bite) or +9 ranged touch (poison, spit)|10 ft./5 ft.|Poison, spit, spells|Darkvision 60 ft.|LG|Fort +7, Ref +7, Will +11|Str 21, Dex 14, Con 19, Int 16, Wis 19, Cha 18|Bluff +18, Concentration +19, Listen +13, Diplomacy +8, Disguise +4 (+6 acting), Intimidate +6, Sense Motive +18, Spellcraft +17, Spot +13; Alertness, Combat Casting, Dodge, Eschew Materials, Lightning Reflexes|MM_p192
506|Spirit naga|9|Large aberration|9d8+36|76|+1|40 ft. (8 squares)|16 (-1 size, +1 dex, +6 natural), touch 10, flat-footed 15|+6|+14|+9 melee (2d6+6 plus poison, bite)|+9 melee (2d6+6 plus poison, bite)|10 ft./5 ft.|Charming gaze, poison, spells|Darkvision 60 ft.|CE|Fort +7, Ref +6, Will +9|Str 18, Dex 13, Con 18, Int 12, Wis 17, Cha 17|Concentration +13, Listen +14, Spellcraft +10, Spot +14; Ability Focus (charming gaze), Alertness, Combat Casting, Eschew Materials, Lightning Reflexes|MM_p192
507|Water naga|7|Large aberration (aquatic)|7d8+28|59|+1|30 ft. (6 squares), swim 50 ft.|15 (-1 size, +1 dex, +5 natural), touch 10, flat-footed 14|+5|+12|+7 melee (2d6+4 plus poison, bite)|+7 melee (2d6+4 plus poison, bite)|10 ft./5 ft.|Poison, spells|Darkvision 60 ft.|N|Fort +6, Ref +5, Will +8|Str 16, Dex 13, Con 18, Int 10, Wis 17, Cha 15|Concentration +12, Listen +7, Spellcraft +8, Spot +7, Swim +11; Alertness, Combat Casting, Eschew Materials, Lightning Reflexes|MM_p193
508|Night hag|9|Medium outsider (evil, extraplanar)|8d8+32|68|+1|20 ft. (4 squares)|22 (+1 dex, +11 natural), touch 11, flat-footed 21|+8|+12|+12 melee (2d6+6 plus disease, bite)|+12 melee (2d6+6 plus disease, bite)|5 ft./5 ft.|Spell-like abilities, dream haunting|Damage reduction 10/cold iron and magic, immunity to fire, cold, charm, sleep,  and fear, spell resistance 25|NE|Fort +12*, Ref +9*, Will +10*;Str 19, Dex 12, Con 18, Int 11, Wis 15, Cha 12|Bluff +12, Concentration +15, Diplomacy +5, Disguise +1 (+3 acting), Intimidate +14, Listen +15, Ride +12, Sense Motive +13, Spellcraft +11, Spot +15; Alertness, Combat Casting, Mounted Combat|MM_p193
509|Nightmare|5|Large outsider (evil, extraplanar)|6d8+18|45|+6|40 ft. (8 squares), fly 90 ft. (good)|24 (-1 size, +2 dex, +13 natural), touch 11, flat-footed 22|+6|+14|+9 melee (1d8+4 plus 1d4 fire, hoof)|+9 melee (1d8+4 plus 1d4 fire, 2 hooves) and +4 melee (1d8+2, bite)|10 ft./5 ft.|Flaming hooves, smoke|Astral projection, darkvision 60 ft., etherealness|NE|Fort +8, Ref +7, Will +6|Str 18, Dex 15, Con 16, Int 13, Wis 13, Cha 12|Concentration +12, Diplomacy +3, Intimidate +10, Knowledge (the planes) +10, Listen +12, Move Silently +11, Search +10, Sense Motive +10, Spot +12, Survival +10 (+12 on other planes and following tracks); Alertness, Improved Initiative, Run|MM_p194
510|Cauchemar nightmare|11|Huge outsider (evil, extraplanar)|15d8+105|172|+6|40 ft. (8 squares), fly 90 ft. (good)|26 (-2 size, +2 dex, +16 natural), touch 10, flat-footed 24|+15|+33|+23 melee (2d6+10 plus 1d4 fire, hoof)|+23 melee (2d6+10 plus 1d4 fire, 2 hooves) and +18 melee (2d6+5, bite)|15 ft./10 ft.|Flaming hooves, smoke|Astral projection, darkvision 60 ft., etherealness|NE|Fort +16, Ref +11, Will +10|Str 31, Dex 14, Con 24, Int 16, Wis 12, Cha 12|Bluff +19, Concentration +25, Diplomacy +5, Disguise +1 (+3 acting), Intimidate +21, Knowledge (arcana) +21, Knowledge (the planes) +21, Listen +21, Move Silently +20, Search +21, Sense Motive +19, Spot +21, Survival +19 (+21 on other planes and following tracks); Alertness, Cleave, Improved Initiative, Power Attack, Run, Track|MM_p194
511|Nightcrawler|18|Gargantuan undead (extraplanar)|25d12+50|212|+4|30 ft. (6 squares), burrow 60 ft.|35 (-4 size, +29 natural), touch 6, flat-footed 35|+12|+45|+29 melee (4d6+21, bite)|+29 melee (4d6+21/19-20, bite) and +24 melee (2d8+11/19-20 plus poison, sting)|20 ft./15 ft.|Desecrating aura, energy drain, spell-like abilities, poison, summon undead, swallow whole|Aversion to daylight, damage reduction 15/silver and magic, darkvision 60 ft., immunity to cold, spell resistance 31, telepathy 100 ft, tremorsense 60 ft., undead traits|CE|Fort +12, Ref +10, Will +23|Str 48, Dex 10, Con -, Int 20, Wis 20, Cha 18|Concentration +32, Diplomacy +6, Hide +16, Knowledge (arcana) +33, Listen +33, Move Silently +28, Search +33, Sense Motive +23, Spellcraft +35, Spot +33, Survival +5 (+7 following tracks); Blind-Fight, Combat Casting, Great Fortitude, Improved Critical (bite), Improved Critical (sting), Improved Initiative, Iron Will, Power Attack, Quicken Spell-Like Ability (cone of cold)|MM_p195
512|Nightwalker|16|Huge undead (extraplanar)|21d12+42|178|+6|40 ft (8 squares)., fly 20 ft. (poor)|32 (-2 size, +2 dex, +22 natural), touch 10, flat-footed 30|+10|+34|+24 melee (2d6+16, slam)|+24 melee (2d6+16, 2 slams)|15 ft./15 ft.|Crush item, desecrating aura, evil gaze, spell-like abilities, summon undead|Aversion to daylight, damage reduction 15/silver and magic, darkvision 60 ft., immunity to cold, spell resistance 29, telepathy 100 ft., undead traits|CE|Fort +11, Ref +11, Will +19|Str 38, Dex 14, Con -, Int 20, Wis 20, Cha 18|Concentration +28, Diplomacy +6, Hide +18*, Knowledge (arcana) +29, Listen +29, Move Silently +26, Search +29, Sense Motive +29, Spellcraft +31, Spot +29, Survival +5 (+7 following tracks); Cleave, Combat Expertise, Combat Reflexes, Great Fortitude, Improved Disarm, Improved Initiative, Power Attack, Quicken Spell-Like Ability (unholy blight)|MM_p196
513|Nightwing|14|Huge undead (extraplanar)|17d12+34|144|+8|20 ft. (4 squares), fly 60 ft. (good)|30 (-2 size, +4 dex, +18 natural), touch 12, flat-footed 26|+8|+28|+18 melee (2d6+17/19-20 plus magic drain, bite)|+18 melee (2d6+17/19-20 plus magic drain, bite)|15 ft./10 ft.|Desecrating aura, magic drain, spell-like abilities, summon undead|Aversion to daylight, damage reduction 15/silver and magic, darkvision 60 ft., immunity to cold, spell resistance 27, telepathy 100 ft., undead traits|CE|Fort +9, Ref +11, Will +17|Str 31, Dex 18, Con -, Int 18, Wis 20, Cha 18|Concentration +24, Diplomacy +6, Hide +16*, Listen +25, Move Silently +24, Search +24, Sense Motive +25, Spellcraft +24, Spot +25, Survival +5 (+7 following tracks); Combat Reflexes, Dodge, Flyby Attack, Great Fortitude, Improved Critical (bite), Improved Initiative|MM_p197
514|Nymph|7|Medium fey|6d6+6|27|+3|30 ft. (6 squares), swim 20 ft.|17 (+3 dex, +4 deflection), touch 17, flat-footed 14|+3|+3|+6 melee (1d4/19-20, dagger)|+6 melee (1d4/19-20, dagger)|5 ft./5 ft.|Blinding beauty, spells, spell-like abilities, stunning glance|Damage reduction 10/cold iron, low-light vision, unearthly grace, wild empathy|CG|Fort +7, Ref +12, Will +12|Str 10, Dex 17, Con 12, Int 16, Wis 17, Cha 19|Concentration +10, Diplomacy +6, Escape Artist +12, Handle Animal +13, Heal +12, Hide +12, Listen +12, Move Silently +12, Ride +5, Sense Motive +12, Spot +12, Swim +8, Use Rope +3 (+5 with bindings); Combat Casting, Dodge, Weapon Finesse|MM_p197
515|Ogre|3|Large giant|4d8+11|29|-1|Spd 30 ft. in hide armor (6 squares); base speed 40 ft.""|16 (-1 size, -1 dex, +5 natural, +3 hide armor), touch 8, flat-footed 16|+3|+12|+8 melee (2d8+7, greatclub) or +1 ranged (1d8+5, javelin)|+8 melee (2d8+7, greatclub) or +1 ranged (1d8+5, javelin)|10 ft./10 ft.|-|Darkvision 60 ft., low-light vision|CE|Fort +6, Ref +0, Will +1|Str 21, Dex 8, Con 15, Int 6, Wis 10, Cha 7|Climb +5, Listen +2, Spot +2; Toughness, Weapon Focus (greatclub)|MM_p199
516|4th-level barbarian ogre|7|Large giant|4d8+19 plus 4d12+16|79|+0|Spd 40 ft. in hide armor (8 squares); base speed 50 ft.""|19 (-1 size, +5 natural, +4 +1 hide armor,  ring of protection +1), touch 10, flat-footed 19|+7|+19|+16 melee (2d8+13, +1 greatclub) or +6 ranged (1d8+8, javelin)|+16 /+11 melee (2d8+13, +1 greatclub) or +6 ranged (1d8+8, javelin)|10 ft./10 ft.|Rage 2/day|Darkvision 60 ft., low-light vision, trap sense +1, uncanny dodge|CE|Fort +12, Ref +2, Will +2|Str 26, Dex 11, Con 18, Int 8, Wis 10, Cha 4|Climb +13, Hide -6, Jump +17, Listen +6, Spot +2; Power Attack, Toughness, Weapon Focus (greatclub)|MM_p199
517|Ogre mage|8|Large giant|5d8+15|37|+4|40 ft. (8 squares), fly 40 ft. (good)|18 (-1 size, +5 natural, +4 chain shirt), touch 9, flat-footed 18|+3|+12|+7 melee (3d6+7/19-20, greatsword) or +2 ranged (2d6/x3, longbow)|+7 melee (3d6+7/19-20, greatsword) or +2 ranged (2d6/x3, longbow)|10 ft./10 ft.|Spell-like abilities|Darkvision 90 ft., low-light vision, regeneration 5, spell resistance 19|LE|Fort +7, Ref +1, Will +3|Str 21, Dex 10, Con 17, Int 14, Wis 14, Cha 17|Concentration +11, Listen +10, Spellcraft +10, Spot +10; Combat Expertise, Improved Initiative|MM_p200
518|Black pudding|7|Huge ooze|10d10+60|115|-5|20 ft. (4 squares), climb 20 ft.|3 (-2 size, -5 dex), touch 3, flat-footed 3|+7|+18|+8 melee (2d6+4 plus 2d6 acid, slam)|+8 melee (2d6+4 plus 2d6 acid, slam)|15 ft./10 ft.|Acid, constrict 2d6+4 plus 2d6 acid, improved grab|Blindsight 60 ft., split, ooze traits|N|Fort +9, Ref -2, Will -2|Str 17, Dex 1, Con 22, Int -, Wis 1, Cha 1|Climb +11; -|MM_p201
519|Elder black pudding|12|Gargantuan ooze|20d10+180|290|-5|20 ft. (4 squares), climb 20 ft.|1 (-4 size, -5 dex), touch 1, flat-footed 1|+15|+35|+19 melee (3d6+12 plus 3d6 acid, slam)|+19 melee (3d6+12 plus 3d6 acid, slam)|20 ft./20 ft.|Acid, constrict 2d8+12 plus 2d6 acid, improved grab|Blindsight 60 ft., split, ooze traits|N|Fort +15, Ref +1, Will +1|Str 26, Dex 1, Con 28, Int -, Wis 1, Cha 1|Climb +16; -|MM_p201
520|Gelatinous cube|3|Huge ooze|4d10+32|54|-5|15 ft. (3 squares)|3 (-2 size, -5 dex), touch 3, flat-footed 3|+3|+11|+1 melee (1d6 plus 1d6 acid, slam)|+1 melee (1d6 plus 1d6 acid, slam)|15 ft./10 ft.|Acid, engulf, paralysis|Blindsight 60 ft., immunity to electricity, ooze traits, transparent|N|Fort +9, Ref -4, Will -4|Str 10, Dex 1, Con 26, Int -, Wis 1, Cha 1|-; -|MM_p201
521|Gray ooze|4|Medium ooze|3d10+15|31|-5|10 ft. (2 squares)|5 (-5 dex), touch 5, flat-footed 5|+2|+3|+3 melee (1d6+1 plus 1d6 acid, slam)|+3 melee (1d6+1 plus 1d6 acid, slam)|5 ft./5 ft.|Acid, constrict 1d6+1 plus 1d6 acid, improved grab|Blindsight 60 ft., immunity to cold and fire, ooze traits, transparent|N|Fort +6, Ref -4, Will -4|Str 12, Dex 1, Con 21, Int -, Wis 1, Cha 1|-; -|MM_p202
522|Ochre jelly|5|Large ooze|6d10+36|69|-5|10 ft. (2 squares), climb 10 ft.|4 (-1 size, -5 dex), touch 4, flat-footed 4|+4|+10|+5 melee (2d4+3 plus 1d4 acid, slam)|+5 melee (2d4+3 plus 1d4 acid, slam)|10 ft./5 ft.|Acid, constrict 2d4+3 plus 1d4 acid, improved grab|Blindsight 60 ft., split, ooze traits|N|Fort +8, Ref -3, Will -3|Str 15, Dex 1, Con 22, Int -, Wis 1, Cha 1|Climb +10; -|MM_p202
